{
  "$schema": "https://json-schema.org/draft/2020-12/schema",
  "$id": "https://raw.githubusercontent.com/conuti-gmbh/bo4e-schema/master/schemas/v1/bo/Marktteilnehmer.schema.json",
  "title": "Marktteilnehmer",
  "type": "object",
  "properties": {
    "boTyp": {
      "$ref": "../enum/BOTyp.schema.json",
      "default": "MARKTTEILNEHMER"
    },
    "versionStruktur": {
      "type": "string",
      "default": "1",
      "description": "versionStruktur"
    },
    "geschaeftspartnerrolle": {
      "$ref": "../enum/Geschaeftspartnerrolle.schema.json",
      "description": "Rolle, die der Geschäftspartner hat (z.B. Interessent, Kunde)."
    },
    "anrede": {
      "type": "string",
      "faker": "person.prefix",
      "description": "Die Anrede für den GePa, Z.B. Herr."
    },
    "name1": {
      "type": "string",
      "faker": "person.lastName",
      "description": "Erster Teil des Namens. Hier kann der Firmenname oder bei Privatpersonen\nbeispielsweise der Nachname dargestellt werden. Beispiele: Yellow Strom GmbH\noder Hagen"
    },
    "name2": {
      "type": "string",
      "faker": "person.firstName",
      "description": "Zweiter Teil des Namens. Hier kann der eine Erweiterung zum Firmennamen oder\nbei Privatpersonen beispielsweise der Vorname dargestellt werden. Beispiele:\nBereich Süd oder Nina"
    },
    "name3": {
      "type": "string",
      "description": "Dritter Teil des Namens. Hier können weitere Ergänzungen zum Firmennamen oder\nbei Privatpersonen Zusätze zum Namen dargestellt werden. Beispiele: und Afrika\noder Sängerin"
    },
    "name4": {
      "type": "string",
      "description": "name4"
    },
    "partneradresse": {
      "$ref": "../com/Adresse.schema.json",
      "description": "Adresse des Geschäftspartners, an der sich der Hauptsitz befindet. Details"
    },
    "gewerbekennzeichnung": {
      "type": "boolean",
      "description": "Kennzeichnung ob es sich um einen Gewerbe/Unternehmen (gewerbeKennzeichnung = true)\noder eine Privatperson handelt. (gewerbeKennzeichnung = false)"
    },
    "externeKundenummerLieferant": {
      "type": "string",
      "description": "externeKundenummerLieferant"
    },
    "marktrolle": {
      "$ref": "../enum/Marktrolle.schema.json",
      "description": "Gibt im Klartext die Bezeichnung der Marktrolle an."
    },
    "rollencodenummer": {
      "type": "string",
      "faker": {
        "string.numeric": 9
      },
      "description": "Gibt die Codenummer der Marktrolle an."
    },
    "rollencodetyp": {
      "$ref": "../enum/Rollencodetyp.schema.json",
      "description": "Gibt den Typ des Codes an."
    },
    "umsatzsteuerId": {
      "type": "string",
      "faker": {
        "string.binary": {
          "prefix": "DE",
          "length": 9
        }
      },
      "description": "Die Umsatzsteuer-ID des Geschäftspartners. Beispiel: DE 813281825"
    },
    "steuernummer": {
      "type": "string",
      "faker": {
        "string.numeric": 9
      },
      "description": "Die Steuernummer-ID des Geschäftspartners. Beispiel: 30120345678"
    },
    "ansprechpartner": {
      "$ref": "../bo/Ansprechpartner.schema.json",
      "description": "Ansprechpartner as in EDIFACT NAD+MS, that includes e.g. the email address of a natural person."
    },
    "makoadresse": {
      "type": "string",
      "description": "Die 1:1-Kommunikationsadresse des Marktteilnehmers. Diese wird in der\nMarktkommunikation verwendet."
    },
    "downloadlinkZertifikat": {
      "type": "string",
      "faker": "internet.url",
      "description": "downloadlinkZertifikat"
    },
    "amtsgericht": {
      "type": "string",
      "faker": "location.city",
      "description": "Amtsgericht bzw Handelsregistergericht, das die Handelsregisternummer herausgegeben hat"
    },
    "hrnummer": {
      "type": "string",
      "faker": {
        "string.numeric": 6
      },
      "description": "Handelsregisternummer des Geschäftspartners"
    },
    "website": {
      "type": "string",
      "faker": "internet.url",
      "description": "Internetseite des Marktpartners. Beispiel: www.mp-energie.de"
    },
    "faxnummer": {
      "type": "string",
      "faker": "phone.number",
      "description": "faxnummer"
    },
    "kommunikationsrolle": {
      "$ref": "../enum/Kommunikationsrolle.schema.json"
    },
    "weiterverpflichtet": {
      "type": "boolean",
      "description": "weiterverpflichtet"
    },
    "kommunikationsparameter": {
      "$ref": "../com/Kommunikationsparameter.schema.json"
    },
    "messstellenbetreiberEigenschaft": {
      "$ref": "../enum/MSBEigenschaft.schema.json"
    },
    "bankverbindung": {
      "type": ["array", "null"],
      "items": {
        "$ref": "../com/Bankverbindung.schema.json"
      },
      "description": "Bankverbindung"
    },
    "erreichbarkeit": {
      "type": ["array", "null"],
      "items": {
        "$ref": "../com/Erreichbarkeit.schema.json"
      },
      "description": "Die Erreichbarkeit eines Unternehmens an Werktagen."
    },
    "ipAdresse": {
      "type": "string",
      "faker": "internet.ip",
      "description": "ipAdresse"
    },
    "ipRange": {
      "$ref": "../com/IpRange.schema.json"
    },
    "zuordnungVon": {
      "type": "string",
      "format": "date-time",
      "description": "Startdatum der Zuordnung des Marktteilnehmers"
    },
    "zuordnungBis": {
      "type": "string",
      "format": "date-time",
      "description": "Enddatum der Zuordnung des Marktteilnehmers"
    },
    "bilanzkreis": {
      "type": "string",
      "description": "Bilanzkreis"
    },
    "verwendungszweckBilanzkreis": {
      "$ref": "../enum/VerwendungszweckBilanzkreis.schema.json",
      "description": "Verwendungszweck des Bilanzkreises"
    },
    "bilanzkreise": {
      "type": ["array", "null"],
      "items": {
        "$ref": "../bo/Bilanzkreis.schema.json"
      },
      "description": "Bilanzkreise"
    }
  },
  "required": [
    "boTyp",
    "versionStruktur"
  ]
}
