{
  "boTyp": "MARKTTEILNEHMER",
  "versionStruktur": "1",
  "geschaeftspartnerrolle": "EIGENTUEMER",
  "anrede": "Prof. Dr.",
  "name1": "Niedermeier",
  "name2": "Joseph",
  "name3": "commodo dolor est sed",
  "name4": "non",
  "partneradresse": {
    "postleitzahl": "63782",
    "ort": "Neumünster",
    "strasse": "Kämper Weg",
    "hausnummer": "76b",
    "postfach": "mollit eu cillum deserunt laboris",
    "adresszusatz": "esse laboris proident amet",
    "coErgaenzung": "irure reprehenderit qui nostrud",
    "landescode": "LC",
    "ortsteil": "Alt Fine",
    "zusatzInformation": {
      "zusatz1": "amet in veniam",
      "zusatz2": "dolor id eiusmod qui",
      "zusatz3": "velit exercitation tempor",
      "zusatz4": "in eiusmod enim",
      "zusatz5": "nostrud veniam ullamco exercitation"
    }
  },
  "gewerbekennzeichnung": true,
  "externeKundenummerLieferant": "nostrud est esse",
  "marktrolle": "NB",
  "rollencodenummer": "120915261",
  "rollencodetyp": "GS1",
  "umsatzsteuerId": "DE110001011",
  "steuernummer": "314310327",
  "ansprechpartner": {
    "boTyp": "ANSPRECHPARTNER",
    "versionStruktur": "1",
    "nachname": "Illing",
    "eMailAdresse": "Mads.Helpling41@hotmail.com",
    "rufnummern": [
      {
        "nummerntyp": "FAX_ZENTRALE",
        "rufnummer": "(0240) 907673487"
      }
    ]
  },
  "makoadresse": "id commodo",
  "downloadlinkZertifikat": "https://wunderhubsch-virus.org/",
  "amtsgericht": "Süd Iven",
  "hrnummer": "772273",
  "website": "https://spritzig-elefant.name/",
  "faxnummer": "+49-5273-73095345",
  "kommunikationsrolle": "ABRECHNUNGSPROZESSE",
  "weiterverpflichtet": false,
  "kommunikationsparameter": {
    "zieladresse": {
      "zieladresse1": "occaecat ullamco cupidatat exercitation Ut",
      "zieladresse2": "voluptate ex",
      "zieladresse3": "Lorem dolor enim",
      "zieladresse4": "nisi officia",
      "zieladresse5": "in aliqua irure"
    },
    "zertifikatsAussteller": {
      "zertifikatsAussteller1": "proident Ut veniam",
      "zertifikatsAussteller2": "minim ut",
      "zertifikatsAussteller3": "sit est",
      "zertifikatsAussteller4": "ea in enim voluptate",
      "zertifikatsAussteller5": "esse eu et cillum"
    },
    "zertifikatsNutzer": {
      "zertifikatsNutzer1": "irure tempor",
      "zertifikatsNutzer2": "nisi ullamco consectetur Duis in",
      "zertifikatsNutzer3": "Ut magna elit dolore",
      "zertifikatsNutzer4": "velit sint",
      "zertifikatsNutzer5": "est dolor aliqua cillum"
    }
  },
  "messstellenbetreiberEigenschaft": "GRUNDZUSTAENDIGER_MESSSTELLENBETREIBER",
  "bankverbindung": [
    {
      "verwendungszweck": "BV_ZAHLUNG_MMMA",
      "iban": "GT219296845A4122535042A1087R",
      "kontoinhaber": "Frau Janne Frey",
      "bic": "EYAVPFJMXXX",
      "kreditinstitut": "Kampf Gruppe"
    }
  ],
  "erreichbarkeit": [
    {
      "verfuegbarkeit": "DONNERSTAG",
      "zeit": "et adipisicing"
    }
  ],
  "ipAdresse": "38.253.21.31",
  "ipRange": {
    "untereGrenze": "edaa:ba87:bf4d:b5ea:fda7:ee3e:4c6c:8736",
    "obereGrenze": "da42:6665:2d2e:20be:f4b0:cddc:1e36:b7b8"
  },
  "zuordnungVon": "1894-04-15T10:42:51.0Z",
  "zuordnungBis": "1915-10-04T21:18:17.0Z",
  "bilanzkreis": "do fugiat",
  "verwendungszweckBilanzkreis": "ERZEUGENDE_MARKTLOKATION_KWKG",
  "bilanzkreise": [
    {
      "boTyp": "BILANZKREIS",
      "versionStruktur": "1",
      "bezeichnung": "magna fugiat aliquip eu",
      "prioritaet": 4,
      "verwendungszweckBilanzkreis": "VERBRAUCHENDE_MARKTLOKATION"
    }
  ]
}